{
  "schema_version": "2.0.0",
  "queue_id": "milk-release-review-contract-fixture",
  "version": "1.0.0",
  "purpose": "human_gold_set_adjudication",
  "authoritative": false,
  "product_pack": {
    "id": "fresh_fluid_milk",
    "version": "1.3.0"
  },
  "policy_checksum": "aaaaaaaaaaaaaaaaaaaaaaaaaaaaaaaaaaaaaaaaaaaaaaaaaaaaaaaaaaaaaaaa",
  "source_evidence": [
    "artifact://classified-search/milk/aldi#sha256=fixture",
    "artifact://classified-search/milk/walmart#sha256=fixture"
  ],
  "sampling": {
    "method": "deterministic_stratified_sha256",
    "per_stratum_limit": 40,
    "include_all_automatic_approvals": true,
    "available_counts": {
      "aldi_us:automatic_exact_specification": 1
    },
    "selected_counts": {
      "aldi_us:automatic_exact_specification": 1
    }
  },
  "cases": [
    {
      "case_id": "case-milk-w10450115-a1234",
      "benchmark_listing_id": "listing-walmart-10450115",
      "competitor_listing_id": "listing-aldi-1234",
      "competitor_retailer_id": "aldi_us",
      "benchmark_listing": {
        "listing_id": "listing-walmart-10450115",
        "retailer_id": "walmart_us",
        "retailer_product_id": "10450115",
        "title": "Great Value 2% Reduced Fat Milk, 1 gal",
        "brand": "Great Value",
        "brand_type": "private_label",
        "brand_verified": true,
        "image_url": "https://i5.walmartimages.com/example-milk.jpeg",
        "product_url": "https://www.walmart.com/ip/10450115",
        "identifiers": [
          {
            "scheme": "retailer_product_id",
            "value": "10450115",
            "verification_status": "observed",
            "source": "search"
          }
        ],
        "attributes": {
          "fat_percent": {
            "value": 2,
            "source": "pdp",
            "reliability": 0.95,
            "review_status": "verified"
          }
        }
      },
      "competitor_listing": {
        "listing_id": "listing-aldi-1234",
        "retailer_id": "aldi_us",
        "retailer_product_id": "1234",
        "title": "Friendly Farms 2% Reduced Fat Milk, 1 gal",
        "brand": "Friendly Farms",
        "brand_type": "private_label",
        "brand_verified": true,
        "image_url": null,
        "product_url": "https://new.aldi.us/product/1234",
        "identifiers": [
          {
            "scheme": "retailer_product_id",
            "value": "1234",
            "verification_status": "observed",
            "source": "search"
          }
        ],
        "attributes": {
          "fat_percent": {
            "value": 2,
            "source": "pdp",
            "reliability": 0.95,
            "review_status": "verified"
          }
        }
      },
      "stratum": "aldi_us:automatic_exact_specification",
      "critical": true,
      "engine_proposal": {
        "edge_id": "edge-w10450115-a1234",
        "tier": "exact_specification",
        "status": "auto_approved",
        "decision_reason": "All required exact-package attributes are known and equal.",
        "evidence_coverage": {
          "known_critical": 4,
          "required_critical": 4,
          "critical_coverage": 1,
          "weighted_evidence_score": null
        }
      },
      "evidence_refs": [
        "artifact://classified-search/milk/aldi#sha256=fixture|edge_id=edge-w10450115-a1234",
        "artifact://classified-search/milk/walmart#sha256=fixture|edge_id=edge-w10450115-a1234"
      ],
      "edge": {
        "schema_version": "2.0.0",
        "edge_id": "edge-w10450115-a1234",
        "policy": {
          "policy_id": "milk_exact_package",
          "version": "1.0.0",
          "product_pack_id": "fresh_fluid_milk",
          "product_pack_version": "1.3.0",
          "checksum": null
        },
        "benchmark_listing_id": "listing-walmart-10450115",
        "competitor_listing_id": "listing-aldi-1234",
        "tier": "exact_specification",
        "status": "auto_approved",
        "brand_relationship": "private_label_to_private_label",
        "eligible_price_bases": [
          "exact_package",
          "normalized_unit"
        ],
        "evidence_coverage": {
          "known_critical": 4,
          "required_critical": 4,
          "critical_coverage": 1,
          "weighted_evidence_score": null
        },
        "attribute_evidence": [
          {
            "attribute": "fat_percent",
            "role": "required_exact",
            "benchmark_value": 2,
            "competitor_value": 2,
            "outcome": "match",
            "benchmark_source": "pdp:walmart_us:10450115",
            "competitor_source": "pdp:aldi_us:1234",
            "weight": 1,
            "reliability": 0.95,
            "rationale": null
          }
        ],
        "applicability": {
          "scope_mode": "observed_distribution",
          "geography_policy": "physical_store_radius",
          "benchmark_location_scope_keys": [],
          "fulfillment_types": ["pickup"],
          "effective_from": "2026-08-15T12:00:00Z",
          "effective_to": null
        },
        "decision": {
          "origin": "deterministic_rule",
          "decided_at": "2026-08-15T12:05:00Z",
          "actor": null,
          "reason": "All required exact-package attributes are known and equal.",
          "supersedes_edge_id": null
        }
      },
      "review_state": "pending"
    }
  ],
  "checksum": "bbbbbbbbbbbbbbbbbbbbbbbbbbbbbbbbbbbbbbbbbbbbbbbbbbbbbbbbbbbbbbbb"
}
